{
  "consumer_hints": {
    "ncp-author": "primary_terms[].ncp_appreciation maps each entry to its closest NCP enum (or null when absent — archetypes / quads / dynamic-pairs / concepts have no NCP target).",
    "novel-architect": "Load this file when answering lyric.bridge-pivot queries; cite ontology entries by id, not label."
  },
  "generated_at": "2026-05-06",
  "generated_from_ontology_version": "0.1",
  "persona": "lyric",
  "primary_pairs": [
    {
      "canonical_label": "Conscience ↔ Temptation",
      "id": "dp.conscience-temptation",
      "pair_member_a": "el.conscience",
      "pair_member_b": "el.temptation",
      "term_file": "skills/dramatica-vocabulary/references/dynamic-pairs-index.md"
    },
    {
      "canonical_label": "Conscious ↔ Memory",
      "id": "dp.conscious-memory",
      "pair_member_a": "type.conscious",
      "pair_member_b": "type.memory",
      "term_file": "skills/dramatica-vocabulary/references/dynamic-pairs-index.md"
    },
    {
      "canonical_label": "Consider ↔ Reconsider",
      "id": "dp.consider-reconsider",
      "pair_member_a": "el.consider",
      "pair_member_b": "el.reconsider",
      "term_file": "skills/dramatica-vocabulary/references/dynamic-pairs-index.md"
    },
    {
      "canonical_label": "Control ↔ Uncontrolled",
      "id": "dp.control-uncontrolled",
      "pair_member_a": "el.control",
      "pair_member_b": "el.uncontrolled",
      "term_file": "skills/dramatica-vocabulary/references/dynamic-pairs-index.md"
    },
    {
      "canonical_label": "Deduction ↔ Induction",
      "id": "dp.deduction-induction",
      "pair_member_a": "el.deduction",
      "pair_member_b": "el.induction",
      "term_file": "skills/dramatica-vocabulary/references/dynamic-pairs-index.md"
    },
    {
      "canonical_label": "Deficiency ↔ Permission",
      "id": "dp.deficiency-permission",
      "pair_member_a": "var.deficiency",
      "pair_member_b": "var.permission",
      "term_file": "skills/dramatica-vocabulary/references/dynamic-pairs-index.md"
    },
    {
      "canonical_label": "Destiny ↔ Fate",
      "id": "dp.destiny-fate",
      "pair_member_a": "var.destiny",
      "pair_member_b": "var.fate",
      "term_file": "skills/dramatica-vocabulary/references/dynamic-pairs-index.md"
    },
    {
      "canonical_label": "Determination ↔ Expectation",
      "id": "dp.determination-expectation",
      "pair_member_a": "el.determination",
      "pair_member_b": "el.expectation",
      "term_file": "skills/dramatica-vocabulary/references/dynamic-pairs-index.md"
    },
    {
      "canonical_label": "Disbelief ↔ Faith",
      "id": "dp.disbelief-faith",
      "pair_member_a": "el.disbelief",
      "pair_member_b": "el.faith",
      "term_file": "skills/dramatica-vocabulary/references/dynamic-pairs-index.md"
    },
    {
      "canonical_label": "Doing ↔ Obtaining",
      "id": "dp.doing-obtaining",
      "pair_member_a": "type.doing",
      "pair_member_b": "type.obtaining",
      "term_file": "skills/dramatica-vocabulary/references/dynamic-pairs-index.md"
    },
    {
      "canonical_label": "Doubt ↔ Investigation",
      "id": "dp.doubt-investigation",
      "pair_member_a": "var.doubt",
      "pair_member_b": "var.investigation",
      "term_file": "skills/dramatica-vocabulary/references/dynamic-pairs-index.md"
    },
    {
      "canonical_label": "Dream ↔ Hope",
      "id": "dp.dream-hope",
      "pair_member_a": "var.dream",
      "pair_member_b": "var.hope",
      "term_file": "skills/dramatica-vocabulary/references/dynamic-pairs-index.md"
    },
    {
      "canonical_label": "Ending ↔ Unending",
      "id": "dp.ending-unending",
      "pair_member_a": "el.ending",
      "pair_member_b": "el.unending",
      "term_file": "skills/dramatica-vocabulary/references/dynamic-pairs-index.md"
    },
    {
      "canonical_label": "Enlightenment ↔ Wisdom",
      "id": "dp.enlightenment-wisdom",
      "pair_member_a": "var.enlightenment",
      "pair_member_b": "var.wisdom",
      "term_file": "skills/dramatica-vocabulary/references/dynamic-pairs-index.md"
    },
    {
      "canonical_label": "Equity ↔ Inequity",
      "id": "dp.equity-inequity",
      "pair_member_a": "el.equity",
      "pair_member_b": "el.inequity",
      "term_file": "skills/dramatica-vocabulary/references/dynamic-pairs-index.md"
    }
  ],
  "primary_quads": [
    {
      "canonical_label": "Actuality",
      "id": "quad.actuality-el",
      "term_file": "skills/dramatica-vocabulary/references/element-quads.md"
    },
    {
      "canonical_label": "Conscience / Temptation",
      "id": "quad.conscience-temptation-el",
      "term_file": "skills/dramatica-vocabulary/references/element-quads.md"
    },
    {
      "canonical_label": "Effect / Cause",
      "id": "quad.effect-cause-el",
      "term_file": "skills/dramatica-vocabulary/references/element-quads.md"
    },
    {
      "canonical_label": "Help / Hinder",
      "id": "quad.help-hinder-el",
      "term_file": "skills/dramatica-vocabulary/references/element-quads.md"
    },
    {
      "canonical_label": "Knowledge",
      "id": "quad.knowledge-el",
      "term_file": "skills/dramatica-vocabulary/references/element-quads.md"
    },
    {
      "canonical_label": "Logic / Feeling",
      "id": "quad.logic-feeling-el",
      "term_file": "skills/dramatica-vocabulary/references/element-quads.md"
    },
    {
      "canonical_label": "Order / Chaos",
      "id": "quad.order-chaos-el",
      "term_file": "skills/dramatica-vocabulary/references/element-quads.md"
    },
    {
      "canonical_label": "Pursuit / Avoid",
      "id": "quad.pursuit-avoid-el",
      "term_file": "skills/dramatica-vocabulary/references/element-quads.md"
    }
  ],
  "primary_terms": [
    {
      "canonical_label": "Certainty",
      "dynamic_pair_id": "el.potentiality",
      "encoding_hint": "a conclusion that something is absolutely true -- The character representing the Certainty characteristic is not a risk taker. It must be completely sure before it takes action or accepts information as true.",
      "id": "el.certainty",
      "kind": "element",
      "ktad_position": "K",
      "ncp_appreciation": null,
      "quad_id": "quad.certainty-potentiality-el",
      "term_file": "skills/dramatica-vocabulary/references/elements.md#certainty"
    },
    {
      "canonical_label": "Change",
      "dynamic_pair_id": "el.inertia",
      "encoding_hint": "Element paired with Inertia in the inertia/change quad. Heading minted by ST-3 to satisfy the canonical entry recorded in `el.change` (Task 015 §Plan Step 4 added the ontology entry; the source heading was never created).",
      "id": "el.change",
      "kind": "element",
      "ktad_position": "T",
      "ncp_appreciation": null,
      "quad_id": "quad.inertia-change-el",
      "term_file": "skills/dramatica-vocabulary/references/elements.md#change"
    },
    {
      "canonical_label": "Consider",
      "dynamic_pair_id": "el.reconsider",
      "encoding_hint": "weighing pros and cons -- A Consideration is the act of deliberation. A character possessing the Consideration characteristic keeps pondering an issue, running it over in his mind.",
      "id": "el.consider",
      "kind": "element",
      "ktad_position": null,
      "ncp_appreciation": null,
      "quad_id": null,
      "term_file": "skills/dramatica-vocabulary/references/elements.md#consider"
    },
    {
      "canonical_label": "Evaluation",
      "dynamic_pair_id": "el.reevaluation",
      "encoding_hint": "an appraisal of a situation and/or circumstances -- Evaluation is the meaning a character finds in a situation or circumstances. Rather than just grappling with the bits and pieces, the character creates an understanding of how all the parts fit together.",
      "id": "el.evaluation",
      "kind": "element",
      "ktad_position": "K",
      "ncp_appreciation": null,
      "quad_id": "quad.evaluation-re-evaluation-el",
      "term_file": "skills/dramatica-vocabulary/references/elements.md#evaluation"
    },
    {
      "canonical_label": "Inaction",
      "dynamic_pair_id": null,
      "encoding_hint": "Inaction does not mean simply sitting still. The Inactive characteristic might choose to allow a course of action by not interfering.",
      "id": "el.inaction",
      "kind": "element",
      "ktad_position": "A",
      "ncp_appreciation": null,
      "quad_id": "quad.evaluation-re-evaluation-el",
      "term_file": "skills/dramatica-vocabulary/references/elements.md#inaction"
    },
    {
      "canonical_label": "Induction",
      "dynamic_pair_id": "el.deduction",
      "encoding_hint": "Induction is the process of thought that determines where an unbroken line of causal relationships leads. The purpose is to see if it is possible that something connects to something else.",
      "id": "el.induction",
      "kind": "element",
      "ktad_position": "D",
      "ncp_appreciation": null,
      "quad_id": "quad.certainty-potentiality-el",
      "term_file": "skills/dramatica-vocabulary/references/elements.md#induction"
    },
    {
      "canonical_label": "Inertia",
      "dynamic_pair_id": "el.change",
      "encoding_hint": "a continuation of a state or process -- Inertia is a tendency to maintain the status quo. That which is moving wants to keep moving.",
      "id": "el.inertia",
      "kind": "element",
      "ktad_position": "K",
      "ncp_appreciation": null,
      "quad_id": "quad.inertia-change-el",
      "term_file": "skills/dramatica-vocabulary/references/elements.md#inertia"
    },
    {
      "canonical_label": "Proaction",
      "dynamic_pair_id": null,
      "encoding_hint": "The Proactive characteristic will urge a character to begin problem solving on his own. This character will be a self-starter who is up and at it the moment he realizes a potential problem exists.",
      "id": "el.proaction",
      "kind": "element",
      "ktad_position": "A",
      "ncp_appreciation": null,